<?xml version="1.0" encoding="UTF-8"?>
<gelCAN:risk-factor-assessments xmlns:vc="http://www.w3.org/2007/XMLSchema-versioning"
 xmlns:gelCAN="https://genomicsengland.co.uk/xsd/cancer/2.0.0"
 xmlns:xsi="http://www.w3.org/2001/XMLSchema-instance"
 xsi:schemaLocation="https://genomicsengland.co.uk/xsd/cancer/2.0.0 file:/Users/genomicsengland/Documents/Cancer/MainProgrammeCancer/Cancer%20Schemas%20v2.0.0%20FINAL/RiskFactorAssessmentsCancer-v2.0.0.xsd">
    <gelCAN:metadata>
        <gelCAN:schema-name>RiskFactorAssessmentsCancer</gelCAN:schema-name>
        <gelCAN:schema-version>2.0.0</gelCAN:schema-version>
        <gelCAN:date>2006-05-04</gelCAN:date>
        <gelCAN:source-organisation>source-organisation0</gelCAN:source-organisation>
        <gelCAN:source-system>source-system0</gelCAN:source-system>
        <gelCAN:local-report-id>local-report-id0</gelCAN:local-report-id>
    </gelCAN:metadata>
    <gelCAN:subject>
        <gelCAN:participant-identifiers>
            <gelCAN:participant-id>participant-id0</gelCAN:participant-id>
            <gelCAN:date-of-birth>2006-05-04</gelCAN:date-of-birth>
            <gelCAN:nhs-number>0000000000</gelCAN:nhs-number>
            <gelCAN:chi-number>chi-number0</gelCAN:chi-number>
            <gelCAN:surname>surname0</gelCAN:surname>
            <gelCAN:forenames>forenames0</gelCAN:forenames>
        </gelCAN:participant-identifiers>
        <gelCAN:general-risk-factors>
            <gelCAN:event-details>
                <gelCAN:event-date>2006-05-04T18:13:51.0</gelCAN:event-date>
                <gelCAN:event-reference>event-reference0</gelCAN:event-reference>
            </gelCAN:event-details>
            <gelCAN:smoking>1</gelCAN:smoking>
            <gelCAN:alcohol-consumption>0</gelCAN:alcohol-consumption>
            <gelCAN:height>0</gelCAN:height>
            <gelCAN:weight>0</gelCAN:weight>
        </gelCAN:general-risk-factors>
        <gelCAN:general-risk-factors>
            <gelCAN:event-details>
                <gelCAN:event-date>2006-05-04T18:13:51.0</gelCAN:event-date>
                <gelCAN:event-reference>event-reference1</gelCAN:event-reference>
            </gelCAN:event-details>
            <gelCAN:smoking>1</gelCAN:smoking>
            <gelCAN:alcohol-consumption>0</gelCAN:alcohol-consumption>
            <gelCAN:height>0</gelCAN:height>
            <gelCAN:weight>0</gelCAN:weight>
        </gelCAN:general-risk-factors>
        <gelCAN:cancer-specific-risk-factors>
            <gelCAN:event-details>
                <gelCAN:event-date>2006-05-04T18:13:51.0</gelCAN:event-date>
                <gelCAN:event-reference>event-reference2</gelCAN:event-reference>
            </gelCAN:event-details>
            <gelCAN:risk-factors>
                <gelCAN:risk-factors-ovarian-cancer>
                    <gelCAN:age-of-menarche>0</gelCAN:age-of-menarche>
                    <gelCAN:age-of-menopause>0</gelCAN:age-of-menopause>
                    <gelCAN:duration-of-ocp>0</gelCAN:duration-of-ocp>
                    <gelCAN:duration-of-hrt>0</gelCAN:duration-of-hrt>
                    <gelCAN:number-of-pregnancies>0</gelCAN:number-of-pregnancies>
                    <gelCAN:number-of-births>0</gelCAN:number-of-births>
                    <gelCAN:endometriosis>unknown</gelCAN:endometriosis>
                    <gelCAN:previous-tubal-ligation>yes</gelCAN:previous-tubal-ligation>
                    <gelCAN:use-of-iud>yes</gelCAN:use-of-iud>
                    <gelCAN:use-of-non-steroidal-anti-inflammatory-drugs>yes</gelCAN:use-of-non-steroidal-anti-inflammatory-drugs>
                    <gelCAN:number-of-children-breastfed>50</gelCAN:number-of-children-breastfed>
                    <gelCAN:number-cycles-ivf>50</gelCAN:number-cycles-ivf>
                </gelCAN:risk-factors-ovarian-cancer>
            </gelCAN:risk-factors>
        </gelCAN:cancer-specific-risk-factors>
        <gelCAN:cancer-specific-risk-factors>
            <gelCAN:event-details>
                <gelCAN:event-date>2006-05-04T18:13:51.0</gelCAN:event-date>
                <gelCAN:event-reference>event-reference3</gelCAN:event-reference>
            </gelCAN:event-details>
            <gelCAN:risk-factors>
                <gelCAN:risk-factors-ovarian-cancer>
                    <gelCAN:age-of-menarche>0</gelCAN:age-of-menarche>
                    <gelCAN:age-of-menopause>0</gelCAN:age-of-menopause>
                    <gelCAN:duration-of-ocp>0</gelCAN:duration-of-ocp>
                    <gelCAN:duration-of-hrt>0</gelCAN:duration-of-hrt>
                    <gelCAN:number-of-pregnancies>0</gelCAN:number-of-pregnancies>
                    <gelCAN:number-of-births>0</gelCAN:number-of-births>
                    <gelCAN:endometriosis>unknown</gelCAN:endometriosis>
                    <gelCAN:previous-tubal-ligation>yes</gelCAN:previous-tubal-ligation>
                    <gelCAN:use-of-iud>yes</gelCAN:use-of-iud>
                    <gelCAN:use-of-non-steroidal-anti-inflammatory-drugs>yes</gelCAN:use-of-non-steroidal-anti-inflammatory-drugs>
                    <gelCAN:number-of-children-breastfed>50</gelCAN:number-of-children-breastfed>
                    <gelCAN:number-cycles-ivf>50</gelCAN:number-cycles-ivf>
                </gelCAN:risk-factors-ovarian-cancer>
            </gelCAN:risk-factors>
        </gelCAN:cancer-specific-risk-factors>
    </gelCAN:subject>
    <gelCAN:subject>
        <gelCAN:participant-identifiers>
            <gelCAN:participant-id>participant-id1</gelCAN:participant-id>
            <gelCAN:date-of-birth>2006-05-04</gelCAN:date-of-birth>
            <gelCAN:nhs-number>0000000000</gelCAN:nhs-number>
            <gelCAN:chi-number>chi-number1</gelCAN:chi-number>
            <gelCAN:surname>surname1</gelCAN:surname>
            <gelCAN:forenames>forenames1</gelCAN:forenames>
        </gelCAN:participant-identifiers>
        <gelCAN:general-risk-factors>
            <gelCAN:event-details>
                <gelCAN:event-date>2006-05-04T18:13:51.0</gelCAN:event-date>
                <gelCAN:event-reference>event-reference4</gelCAN:event-reference>
            </gelCAN:event-details>
            <gelCAN:smoking>1</gelCAN:smoking>
            <gelCAN:alcohol-consumption>0</gelCAN:alcohol-consumption>
            <gelCAN:height>0</gelCAN:height>
            <gelCAN:weight>0</gelCAN:weight>
        </gelCAN:general-risk-factors>
        <gelCAN:general-risk-factors>
            <gelCAN:event-details>
                <gelCAN:event-date>2006-05-04T18:13:51.0</gelCAN:event-date>
                <gelCAN:event-reference>event-reference5</gelCAN:event-reference>
            </gelCAN:event-details>
            <gelCAN:smoking>1</gelCAN:smoking>
            <gelCAN:alcohol-consumption>0</gelCAN:alcohol-consumption>
            <gelCAN:height>0</gelCAN:height>
            <gelCAN:weight>0</gelCAN:weight>
        </gelCAN:general-risk-factors>
        <gelCAN:cancer-specific-risk-factors>
            <gelCAN:event-details>
                <gelCAN:event-date>2006-05-04T18:13:51.0</gelCAN:event-date>
                <gelCAN:event-reference>event-reference6</gelCAN:event-reference>
            </gelCAN:event-details>
            <gelCAN:risk-factors>
                <gelCAN:risk-factors-ovarian-cancer>
                    <gelCAN:age-of-menarche>0</gelCAN:age-of-menarche>
                    <gelCAN:age-of-menopause>0</gelCAN:age-of-menopause>
                    <gelCAN:duration-of-ocp>0</gelCAN:duration-of-ocp>
                    <gelCAN:duration-of-hrt>0</gelCAN:duration-of-hrt>
                    <gelCAN:number-of-pregnancies>0</gelCAN:number-of-pregnancies>
                    <gelCAN:number-of-births>0</gelCAN:number-of-births>
                    <gelCAN:endometriosis>unknown</gelCAN:endometriosis>
                    <gelCAN:previous-tubal-ligation>yes</gelCAN:previous-tubal-ligation>
                    <gelCAN:use-of-iud>yes</gelCAN:use-of-iud>
                    <gelCAN:use-of-non-steroidal-anti-inflammatory-drugs>yes</gelCAN:use-of-non-steroidal-anti-inflammatory-drugs>
                    <gelCAN:number-of-children-breastfed>50</gelCAN:number-of-children-breastfed>
                    <gelCAN:number-cycles-ivf>50</gelCAN:number-cycles-ivf>
                </gelCAN:risk-factors-ovarian-cancer>
            </gelCAN:risk-factors>
        </gelCAN:cancer-specific-risk-factors>
        <gelCAN:cancer-specific-risk-factors>
            <gelCAN:event-details>
                <gelCAN:event-date>2006-05-04T18:13:51.0</gelCAN:event-date>
                <gelCAN:event-reference>event-reference7</gelCAN:event-reference>
            </gelCAN:event-details>
            <gelCAN:risk-factors>
                <gelCAN:risk-factors-ovarian-cancer>
                    <gelCAN:age-of-menarche>0</gelCAN:age-of-menarche>
                    <gelCAN:age-of-menopause>0</gelCAN:age-of-menopause>
                    <gelCAN:duration-of-ocp>0</gelCAN:duration-of-ocp>
                    <gelCAN:duration-of-hrt>0</gelCAN:duration-of-hrt>
                    <gelCAN:number-of-pregnancies>0</gelCAN:number-of-pregnancies>
                    <gelCAN:number-of-births>0</gelCAN:number-of-births>
                    <gelCAN:endometriosis>unknown</gelCAN:endometriosis>
                    <gelCAN:previous-tubal-ligation>yes</gelCAN:previous-tubal-ligation>
                    <gelCAN:use-of-iud>yes</gelCAN:use-of-iud>
                    <gelCAN:use-of-non-steroidal-anti-inflammatory-drugs>yes</gelCAN:use-of-non-steroidal-anti-inflammatory-drugs>
                    <gelCAN:number-of-children-breastfed>50</gelCAN:number-of-children-breastfed>
                    <gelCAN:number-cycles-ivf>50</gelCAN:number-cycles-ivf>
                </gelCAN:risk-factors-ovarian-cancer>
            </gelCAN:risk-factors>
        </gelCAN:cancer-specific-risk-factors>
    </gelCAN:subject>
</gelCAN:risk-factor-assessments>
